{
  "id": "proj_nowinboxcore",
  "slug": "now-inbox-core",
  "name": "Now + Inbox Core",
  "family": "work",
  "status": "active",
  "primary_repo": {
    "path": "/home/jove/code/vel",
    "label": "vel",
    "kind": "repo"
  },
  "primary_notes_root": {
    "path": "/home/jove/notes/vel",
    "label": "Vel Notes",
    "kind": "notes_root"
  },
  "secondary_repos": [
    {
      "path": "/home/jove/code/vel-experiments",
      "label": "vel-experiments",
      "kind": "repo"
    }
  ],
  "secondary_notes_roots": [],
  "upstream_ids": {
    "todoist_project_id": "todoist_9812",
    "notes_workspace_id": "obsidian_vel"
  },
  "pending_provision": {
    "create_repo": false,
    "create_notes_root": true
  },
  "created_at": "2026-03-18T16:00:00Z",
  "updated_at": "2026-03-18T16:05:00Z",
  "archived_at": null
}
